{
  "diensttag": "2026-09-30",
  "status": "abgeschlossen",
  "begonnen_um": "2026-09-30T18:50:00+02:00",
  "besetzung": [
    {
      "rolle": "Betreuung 1",
      "person": "Kim",
      "geplant": "Kim",
      "grund": null,
      "unterschrift": "Unterschriften/Betreuung-1_Kim.png",
      "unterschrieben_um": "2026-09-30T22:30:00+02:00"
    },
    {
      "rolle": "Betreuung 2",
      "person": "Chris",
      "geplant": "Chris",
      "grund": null,
      "unterschrift": "Unterschriften/Betreuung-2_Chris.png",
      "unterschrieben_um": "2026-09-30T22:30:00+02:00"
    },
    {
      "rolle": "Küche",
      "person": "Mika",
      "geplant": "Mika",
      "grund": null,
      "unterschrift": "Unterschriften/Kueche_Mika.png",
      "unterschrieben_um": "2026-09-30T22:30:00+02:00"
    }
  ],
  "felder": {
    "kht_angerufen": "nein",
    "hinweise": "Lukas (B3) ist nicht gekommen, fehlt unentschuldigt.",
    "fragen": "",
    "abwesenheiten": [],
    "externe_gaeste": [],
    "vorfaelle": "nein",
    "schluessel_fehlt": "nein",
    "schluessel_nr": "",
    "fehlt_etwas": [],
    "fehlt_etwas_text": "",
    "sonstiges": ""
  },
  "zuordnung": [],
  "kennzahlen": {
    "kht_nummer": 25,
    "frei": 6,
    "gesamt": 31,
    "ampel": "gruen",
    "st_nikolaus_belegt": 7
  },
  "ohne_unterschrift": [],
  "abgeschlossen_um": "2026-10-01T07:58:00+02:00",
  "pdf": "2026-09-30_Dienstbericht.pdf",
  "_meta": {
    "schema": "bericht/1",
    "geaendert_um": "2026-10-01T07:58:00+02:00",
    "geaendert_von": "Kim",
    "geraet": "tablet-st-pius",
    "version": 23
  }
}
